{
  "cleanup_result": {
    "ok": true,
    "results": [
      {
        "command": "containerlab destroy -t benchmarks/testbeds/containerlab/sme01-qos/topology.clab.yml --cleanup",
        "ok": true,
        "reason": null,
        "returncode": 0,
        "safe": true,
        "stderr": "02:43:59 INFO Parsing & checking topology file=topology.clab.yml\n02:43:59 INFO Parsing & checking topology file=topology.clab.yml\n02:43:59 INFO Destroying lab name=sme01-qos\n02:44:00 INFO Removed container name=clab-sme01-qos-app1\n02:44:00 INFO Removed container name=clab-sme01-qos-admin1\n02:44:00 INFO Removed container name=clab-sme01-qos-leaf1\n02:44:00 INFO Removed container name=clab-sme01-qos-spine1\n02:44:00 INFO Removed container name=clab-sme01-qos-spine2\n02:44:00 INFO Removed container name=clab-sme01-qos-leaf2\n02:44:00 INFO Removed container name=clab-sme01-qos-finance1\n02:44:00 INFO Removed container name=clab-sme01-qos-web1\n02:44:00 INFO Removed container name=clab-sme01-qos-guest1\n02:44:00 INFO Removed container name=clab-sme01-qos-external1\n02:44:00 INFO Removed container name=clab-sme01-qos-attacker1\n02:44:01 INFO Removed container name=clab-sme01-qos-wan1\n02:44:01 INFO Removed container name=clab-sme01-qos-user1\n02:44:01 INFO Removing host entries path=/etc/hosts\n02:44:01 INFO Removing SSH config path=/etc/ssh/ssh_config.d/clab-sme01-qos.conf\n",
        "stdout": "",
        "target": "sme01-qos"
      }
    ]
  },
  "convergence_result": {
    "converged": true,
    "interval_seconds": 2.0,
    "lease_renewal": {
      "clients": []
    },
    "observation": {
      "connectivity": [
        {
          "destination": "web1",
          "destination_ip": "10.10.40.10",
          "hostname": null,
          "output": "PING 10.10.40.10 (10.10.40.10) 56(84) bytes of data.\n64 bytes from 10.10.40.10: icmp_seq=1 ttl=61 time=0.713 ms\n64 bytes from 10.10.40.10: icmp_seq=2 ttl=61 time=0.700 ms\n64 bytes from 10.10.40.10: icmp_seq=3 ttl=61 time=0.632 ms\n\n--- 10.10.40.10 ping statistics ---\n3 packets transmitted, 3 received, 0% packet loss, time 2029ms\nrtt min/avg/max/mdev = 0.632/0.681/0.713/0.035 ms",
          "packet_loss_percent": 0.0,
          "resolved_ip": null,
          "source": "user1",
          "success": true
        },
        {
          "destination": "user1",
          "destination_ip": "10.10.10.10",
          "hostname": null,
          "output": "PING 10.10.10.10 (10.10.10.10) 56(84) bytes of data.\n64 bytes from 10.10.10.10: icmp_seq=1 ttl=61 time=0.651 ms\n64 bytes from 10.10.10.10: icmp_seq=2 ttl=61 time=0.614 ms\n64 bytes from 10.10.10.10: icmp_seq=3 ttl=61 time=0.682 ms\n\n--- 10.10.10.10 ping statistics ---\n3 packets transmitted, 3 received, 0% packet loss, time 2040ms\nrtt min/avg/max/mdev = 0.614/0.649/0.682/0.027 ms",
          "packet_loss_percent": 0.0,
          "resolved_ip": null,
          "source": "web1",
          "success": true
        },
        {
          "destination": "app1",
          "destination_ip": "10.10.50.10",
          "hostname": null,
          "output": "PING 10.10.50.10 (10.10.50.10) 56(84) bytes of data.\n64 bytes from 10.10.50.10: icmp_seq=1 ttl=61 time=0.914 ms\n64 bytes from 10.10.50.10: icmp_seq=2 ttl=61 time=0.688 ms\n64 bytes from 10.10.50.10: icmp_seq=3 ttl=61 time=0.690 ms\n\n--- 10.10.50.10 ping statistics ---\n3 packets transmitted, 3 received, 0% packet loss, time 2048ms\nrtt min/avg/max/mdev = 0.688/0.764/0.914/0.106 ms",
          "packet_loss_percent": 0.0,
          "resolved_ip": null,
          "source": "user1",
          "success": true
        },
        {
          "destination": "user1",
          "destination_ip": "10.10.10.10",
          "hostname": null,
          "output": "PING 10.10.10.10 (10.10.10.10) 56(84) bytes of data.\n64 bytes from 10.10.10.10: icmp_seq=1 ttl=61 time=0.944 ms\n64 bytes from 10.10.10.10: icmp_seq=2 ttl=61 time=0.710 ms\n64 bytes from 10.10.10.10: icmp_seq=3 ttl=61 time=0.651 ms\n\n--- 10.10.10.10 ping statistics ---\n3 packets transmitted, 3 received, 0% packet loss, time 2041ms\nrtt min/avg/max/mdev = 0.651/0.768/0.944/0.126 ms",
          "packet_loss_percent": 0.0,
          "resolved_ip": null,
          "source": "app1",
          "success": true
        },
        {
          "destination": "web1",
          "destination_ip": "10.10.40.10",
          "hostname": null,
          "output": "PING 10.10.40.10 (10.10.40.10) 56(84) bytes of data.\n64 bytes from 10.10.40.10: icmp_seq=1 ttl=61 time=0.762 ms\n64 bytes from 10.10.40.10: icmp_seq=2 ttl=61 time=0.659 ms\n64 bytes from 10.10.40.10: icmp_seq=3 ttl=61 time=0.637 ms\n\n--- 10.10.40.10 ping statistics ---\n3 packets transmitted, 3 received, 0% packet loss, time 2045ms\nrtt min/avg/max/mdev = 0.637/0.686/0.762/0.054 ms",
          "packet_loss_percent": 0.0,
          "resolved_ip": null,
          "source": "guest1",
          "success": true
        },
        {
          "destination": "guest1",
          "destination_ip": "10.10.20.10",
          "hostname": null,
          "output": "PING 10.10.20.10 (10.10.20.10) 56(84) bytes of data.\n64 bytes from 10.10.20.10: icmp_seq=1 ttl=61 time=0.676 ms\n64 bytes from 10.10.20.10: icmp_seq=2 ttl=61 time=0.621 ms\n64 bytes from 10.10.20.10: icmp_seq=3 ttl=61 time=0.603 ms\n\n--- 10.10.20.10 ping statistics ---\n3 packets transmitted, 3 received, 0% packet loss, time 2036ms\nrtt min/avg/max/mdev = 0.603/0.633/0.676/0.031 ms",
          "packet_loss_percent": 0.0,
          "resolved_ip": null,
          "source": "web1",
          "success": true
        },
        {
          "destination": "app1",
          "destination_ip": "10.10.50.10",
          "hostname": null,
          "output": "PING 10.10.50.10 (10.10.50.10) 56(84) bytes of data.\n64 bytes from 10.10.50.10: icmp_seq=1 ttl=63 time=0.243 ms\n64 bytes from 10.10.50.10: icmp_seq=2 ttl=63 time=0.521 ms\n64 bytes from 10.10.50.10: icmp_seq=3 ttl=63 time=0.279 ms\n\n--- 10.10.50.10 ping statistics ---\n3 packets transmitted, 3 received, 0% packet loss, time 2040ms\nrtt min/avg/max/mdev = 0.243/0.347/0.521/0.123 ms",
          "packet_loss_percent": 0.0,
          "resolved_ip": null,
          "source": "finance1",
          "success": true
        },
        {
          "destination": "finance1",
          "destination_ip": "10.10.30.10",
          "hostname": null,
          "output": "PING 10.10.30.10 (10.10.30.10) 56(84) bytes of data.\n64 bytes from 10.10.30.10: icmp_seq=1 ttl=63 time=0.292 ms\n64 bytes from 10.10.30.10: icmp_seq=2 ttl=63 time=0.221 ms\n64 bytes from 10.10.30.10: icmp_seq=3 ttl=63 time=0.223 ms\n\n--- 10.10.30.10 ping statistics ---\n3 packets transmitted, 3 received, 0% packet loss, time 2040ms\nrtt min/avg/max/mdev = 0.221/0.245/0.292/0.033 ms",
          "packet_loss_percent": 0.0,
          "resolved_ip": null,
          "source": "app1",
          "success": true
        },
        {
          "destination": "web1",
          "destination_ip": "10.10.40.10",
          "hostname": null,
          "output": "PING 10.10.40.10 (10.10.40.10) 56(84) bytes of data.\n64 bytes from 10.10.40.10: icmp_seq=1 ttl=61 time=0.568 ms\n64 bytes from 10.10.40.10: icmp_seq=2 ttl=61 time=0.509 ms\n64 bytes from 10.10.40.10: icmp_seq=3 ttl=61 time=0.569 ms\n\n--- 10.10.40.10 ping statistics ---\n3 packets transmitted, 3 received, 0% packet loss, time 2048ms\nrtt min/avg/max/mdev = 0.509/0.548/0.569/0.028 ms",
          "packet_loss_percent": 0.0,
          "resolved_ip": null,
          "source": "external1",
          "success": true
        },
        {
          "destination": "external1",
          "destination_ip": "203.0.113.10",
          "hostname": null,
          "output": "PING 203.0.113.10 (203.0.113.10) 56(84) bytes of data.\n64 bytes from 203.0.113.10: icmp_seq=1 ttl=61 time=0.683 ms\n64 bytes from 203.0.113.10: icmp_seq=2 ttl=61 time=0.514 ms\n64 bytes from 203.0.113.10: icmp_seq=3 ttl=61 time=0.550 ms\n\n--- 203.0.113.10 ping statistics ---\n3 packets transmitted, 3 received, 0% packet loss, time 2040ms\nrtt min/avg/max/mdev = 0.514/0.582/0.683/0.072 ms",
          "packet_loss_percent": 0.0,
          "resolved_ip": null,
          "source": "web1",
          "success": true
        },
        {
          "destination": "external1",
          "destination_ip": "203.0.113.10",
          "hostname": null,
          "output": "PING 203.0.113.10 (203.0.113.10) 56(84) bytes of data.\n64 bytes from 203.0.113.10: icmp_seq=1 ttl=61 time=0.583 ms\n64 bytes from 203.0.113.10: icmp_seq=2 ttl=61 time=0.597 ms\n64 bytes from 203.0.113.10: icmp_seq=3 ttl=61 time=0.536 ms\n\n--- 203.0.113.10 ping statistics ---\n3 packets transmitted, 3 received, 0% packet loss, time 2056ms\nrtt min/avg/max/mdev = 0.536/0.572/0.597/0.026 ms",
          "packet_loss_percent": 0.0,
          "resolved_ip": null,
          "source": "user1",
          "success": true
        },
        {
          "destination": "user1",
          "destination_ip": "10.10.10.10",
          "hostname": null,
          "output": "PING 10.10.10.10 (10.10.10.10) 56(84) bytes of data.\n64 bytes from 10.10.10.10: icmp_seq=1 ttl=61 time=0.636 ms\n64 bytes from 10.10.10.10: icmp_seq=2 ttl=61 time=0.473 ms\n64 bytes from 10.10.10.10: icmp_seq=3 ttl=61 time=0.549 ms\n\n--- 10.10.10.10 ping statistics ---\n3 packets transmitted, 3 received, 0% packet loss, time 2057ms\nrtt min/avg/max/mdev = 0.473/0.552/0.636/0.066 ms",
          "packet_loss_percent": 0.0,
          "resolved_ip": null,
          "source": "external1",
          "success": true
        },
        {
          "destination": "external1",
          "destination_ip": "203.0.113.10",
          "hostname": null,